{"detectors":{"changepoint":{"splits":{"test":{"days":14.467592592592593,"delay_median_s":[41.0,41.0,43.0,45.0,48.0,49.5,51.0,58.0,60.0,67.0,75.0,75.0,80.0,89.5,90.0,90.0,94.0,102.0,100.0,100.0,107.5,107.5,128.0,129.5,137.5,135.0,142.0,144.0,144.0,156.5,165.5,162.5,167.0,167.5,172.0,172.0,176.5,172.0,172.0,172.5,181.5,181.5,181.5,186.5,186.0,211.5,211.5,203.0,203.0,211.5,220.0,220.0,224.0,222.5,221.0,212.0,221.0,231.0,234.0,234.0,234.0,243.0,243.0,243.0,243.0,243.0,243.0,248.0,248.0,244.0,228.5,252.0,254.0,258.0,262.0,268.5,262.0,268.5,262.0,262.0,268.5,268.5,262.0,218.5,218.5,223.5,185.0,272.0,228.5,228.5,228.5,272.0,272.0,272.0,272.0,272.0,272.0,272.0,282.0,282.0,282.0,282.0,282.0,282.0,282.0,282.0,282.0,288.5,282.0,282.0,282.0,282.0,282.0,282.0,282.0,292.0,292.0,292.0,292.0,292.0,292.0,292.0,292.0,223.5,233.5,302.0,303.5,303.5,305.0,305.0,305.0,315.0,315.0,325.0,325.0,345.0,345.0,345.0,-1.0,-1.0,-1.0,-1.0,-1.0,-1.0,-1.0,-1.0],"ev_alerts":[3927,3754,3583,3435,3276,3131,2977,2830,2703,2609,2463,2368,2261,2132,2025,1923,1859,1779,1687,1604,1516,1452,1368,1308,1238,1169,1096,1027,975,934,891,838,797,756,726,689,654,611,578,543,520,494,473,437,417,390,368,348,327,310,290,272,252,244,218,210,204,190,175,161,152,141,136,126,113,105,100,94,86,79,75,66,60,58,51,45,43,39,37,33,29,28,27,27,27,27,27,25,24,22,22,18,18,17,17,17,17,17,17,16,16,16,16,16,16,16,14,13,11,11,11,10,10,10,9,7,7,6,6,6,6,6,6,5,5,4,3,3,2,2,1,1,1,1,1,1,1,1,0,0,0,0,0,0,0,0],"ev_detected":[67,67,67,67,67,66,65,64,64,63,63,62,60,60,59,59,59,58,56,55,54,54,53,52,52,51,50,48,46,46,46,44,43,42,42,42,42,40,40,38,38,38,38,38,37,36,36,35,35,34,33,33,33,32,31,30,29,29,29,29,29,28,28,28,28,28,28,28,28,27,26,25,23,22,21,20,19,18,17,15,14,14,13,12,12,12,11,11,10,10,10,9,9,9,9,9,9,9,9,9,9,9,9,9,9,9,7,6,5,5,5,5,5,5,5,5,5,5,5,5,5,5,5,4,4,3,2,2,1,1,1,1,1,1,1,1,1,1,0,0,0,0,0,0,0,0],"ev_false":[3700,3528,3354,3208,3049,2902,2751,2610,2487,2395,2254,2164,2060,1938,1829,1731,1674,1604,1520,1444,1360,1298,1219,1162,1097,1033,964,899,848,808,767,719,680,643,614,578,545,506,470,438,418,395,376,342,323,298,278,259,239,223,204,187,168,161,138,132,125,113,98,88,80,71,67,59,51,43,39,34,27,23,20,17,15,14,11,9,8,6,6,6,5,4,4,4,4,4,4,4,4,4,4,3,3,2,2,2,2,2,2,2,2,2,2,2,2,2,2,2,2,2,2,2,2,2,2,0,0,0,0,0,0,0,0,0,0,0,0,0,0,0,0,0,0,0,0,0,0,0,0,0,0,0,0,0,0,0],"p_fp":[323098,302886,283751,266026,249114,233417,217267,203929,190624,178228,167016,157017,147885,138660,129202,121014,113445,105686,98786,93085,86948,81173,75405,70625,66065,61915,57875,53229,49359,46119,42982,40028,37238,34938,32735,30445,28400,26420,24760,23250,21377,19917,18627,17357,16177,15117,13957,12747,11787,10878,10161,9271,8661,8106,7346,6756,6276,5776,5186,4746,4316,4066,3786,3526,3108,2838,2588,2378,2118,1928,1768,1580,1450,1340,1200,1140,1090,1010,969,939,919,849,799,769,709,669,629,599,579,539,519,440,440,420,420,400,390,360,350,340,320,310,310,290,290,290,277,267,247,230,210,150,140,140,130,100,100,90,80,80,80,80,80,80,70,60,60,60,30,20,0,0,0,0,0,0,0,0,0,0,0,0,0,0,0,0],"p_tp":[32211,31033,30018,28883,27755,26942,25982,25030,24126,23152,22264,21373,20415,19640,18858,18116,17515,16854,16224,15655,15132,14607,14185,13845,13505,13095,12735,12361,12031,11711,11408,11052,10782,10562,10345,10095,9850,9570,9290,9060,8903,8713,8523,8393,8153,7973,7843,7653,7573,7432,7289,7119,6969,6804,6744,6574,6404,6174,6064,5864,5784,5564,5414,5324,5142,4982,4792,4602,4212,3962,3822,3620,3350,3180,2960,2790,2670,2480,2251,1981,1891,1801,1741,1641,1541,1471,1391,1311,1271,1161,1121,1050,1030,1000,990,930,890,800,790,780,770,770,750,720,690,690,583,533,503,480,480,450,440,430,430,410,410,330,320,300,280,280,280,250,190,160,140,140,110,110,110,90,90,60,60,20,20,20,0,0,0,0,0,0,0,0],"pa_tp":[58900,58900,58900,58900,58900,58500,58100,57800,57800,57100,57100,56600,55800,55800,55400,55400,55400,55100,53800,53500,53000,53000,52700,52400,52400,51700,51000,50100,47700,47700,47700,46900,46600,46300,46300,46300,46300,45200,45200,43800,43800,43800,43800,43800,38800,38400,38400,33400,33400,32700,32400,32400,32400,32000,31000,30300,29900,29900,29900,29900,29900,29600,29600,29600,29600,29600,29600,29600,29600,29100,24100,23800,22400,21700,21200,20500,19800,19400,19100,17700,12700,12700,12000,11000,11000,11000,10000,10000,8000,8000,8000,7000,7000,7000,7000,7000,7000,7000,7000,7000,7000,7000,7000,7000,7000,7000,5600,3600,2600,2600,2600,2600,2600,2600,2600,2600,2600,2600,2600,2600,2600,2600,2600,2100,2100,1700,1200,1200,500,500,500,500,500,500,500,500,500,500,0,0,0,0,0,0,0,0],"positives":58900,"rows":1250000,"segments":67},"val":{"days":14.467592592592593,"delay_median_s":[29.0,35.5,43.0,50.5,61.0,62.0,69.0,69.0,69.0,66.5,66.5,83.0,83.0,83.0,83.0,79.0,79.0,87.0,87.0,101.0,99.0,107.5,102.0,112.0,107.0,107.0,107.0,111.5,112.0,123.0,123.5,123.5,130.0,154.0,159.0,163.5,170.5,178.5,191.0,216.5,244.0,242.0,256.0,249.0,249.0,242.0,254.0,254.0,256.5,256.5,261.5,269.5,278.0,278.0,272.0,284.0,278.0,284.0,300.0,316.0,316.0,316.0,333.0,339.5,339.5,346.0,346.0,344.5,336.0,341.0,341.0,326.0,331.0,331.0,331.0,331.0,316.0,316.0,336.0,356.0,361.0,361.0,366.0,366.0,366.0,366.0,376.0,376.0,371.0,371.0,371.5,371.5,367.0,376.0,376.0,376.0,411.0,411.0,411.0,426.0,426.0,426.0,426.0,463.0,552.5,552.5,557.5,426.0,423.5,423.5,421.0,431.0,431.0,431.0,431.0,541.0,541.0,468.5,473.5,473.5,473.5,541.0,541.0,1099.0,1099.0,1104.0,1104.0,1104.0,1104.0,1109.0,1109.0,1657.0,1657.0,1667.0,1667.0,1677.0,1677.0,1677.0,1687.0,1697.0,1697.0,1697.0,1697.0,1707.0,1707.0,1707.0],"ev_alerts":[4022,3858,3714,3581,3412,3258,3124,2996,2854,2733,2604,2478,2357,2246,2146,2050,1953,1857,1776,1703,1641,1588,1507,1437,1365,1295,1230,1177,1115,1041,996,950,899,850,815,769,731,693,649,606,568,546,512,484,462,429,408,386,363,335,314,290,275,249,236,222,206,193,181,168,157,144,137,123,111,101,92,87,79,76,76,72,66,61,59,53,50,46,44,44,40,40,40,38,35,34,34,30,29,25,24,23,21,21,20,20,18,18,18,18,18,18,17,16,15,14,13,12,10,10,7,7,7,7,7,6,6,5,5,5,5,4,4,3,3,3,3,3,2,2,2,1,1,1,1,1,1,1,1,1,1,1,1,1,1,1],"ev_detected":[48,48,48,48,47,47,47,47,47,46,46,46,46,46,46,45,45,45,45,45,44,44,43,43,42,42,42,42,42,41,40,40,40,39,39,38,38,38,37,36,36,35,35,34,34,33,32,32,32,32,32,32,32,32,31,29,28,27,26,25,25,25,25,24,24,23,23,22,20,20,20,18,18,18,18,18,17,17,16,16,14,14,14,13,13,13,13,11,10,10,10,10,9,9,9,9,9,9,9,9,9,9,9,9,8,8,8,7,6,6,5,5,5,5,5,5,5,4,4,4,4,3,3,2,2,2,2,2,2,2,2,1,1,1,1,1,1,1,1,1,1,1,1,1,1,1],"ev_false":[3851,3686,3546,3416,3253,3102,2965,2835,2692,2579,2448,2323,2204,2090,1986,1893,1803,1711,1631,1559,1494,1439,1362,1293,1219,1151,1089,1038,980,910,864,820,770,722,689,648,613,580,542,504,470,450,420,393,368,338,320,299,276,249,228,206,193,169,158,146,131,119,107,96,84,73,69,60,50,41,31,30,25,22,22,20,16,11,10,6,6,6,6,6,6,7,7,7,6,5,5,3,3,2,2,2,1,1,1,1,1,1,1,1,1,1,1,1,1,1,1,1,1,1,0,0,0,0,0,0,0,0,0,0,0,0,0,0,0,0,0,0,0,0,0,0,0,0,0,0,0,0,0,0,0,0,0,0,0,0],"p_fp":[347128,325918,306078,287341,269658,253029,237517,222887,209186,196346,184029,172596,161736,151722,142222,133401,124981,117101,109741,102891,96401,90244,84415,78925,73785,68976,64396,60240,56257,52474,49108,45811,42741,39771,36987,34477,32080,29790,27700,25744,23886,22140,20490,18943,17450,16140,14929,13739,12609,11569,10579,9689,8870,8090,7350,6710,6140,5570,5070,4550,4050,3624,3254,2962,2642,2332,2012,1822,1611,1441,1321,1191,1021,901,801,741,691,631,601,561,529,499,489,459,419,369,349,323,273,243,223,213,193,193,183,170,160,157,147,147,127,117,107,107,107,97,97,87,87,87,77,77,77,77,70,60,60,60,60,60,50,50,40,40,20,20,20,10,0,0,0,0,0,0,0,0,0,0,0,0,0,0,0,0,0,0],"p_tp":[27953,27113,26223,25440,24793,24172,23374,22694,22034,21304,20801,20234,19784,19148,18608,17989,17539,17039,16529,15979,15489,15086,14735,14405,14065,13744,13464,13050,12753,12446,12022,11729,11429,11199,10993,10693,10440,10230,9980,9716,9494,9300,9100,8897,8760,8530,8301,8121,7971,7801,7661,7481,7290,7150,6970,6770,6560,6370,6170,6030,5910,5756,5576,5348,5178,5028,4918,4708,4529,4339,4129,3929,3799,3639,3479,3279,3099,2939,2759,2599,2451,2301,2151,2021,1921,1831,1721,1627,1567,1487,1407,1317,1247,1167,1097,1030,970,913,863,803,763,723,683,633,593,563,523,503,463,433,413,383,353,333,320,300,280,260,240,230,220,200,200,190,190,180,170,170,170,160,150,140,130,120,110,100,90,90,80,70,70,60,50,40,30,30],"pa_tp":[53300,53300,53300,53300,53000,53000,53000,53000,53000,52600,52600,52600,52600,52600,52600,52200,52200,52200,52200,52200,51700,51700,51000,51000,50700,50700,50700,50700,50700,50000,49600,49600,49600,48900,48900,48200,48200,48200,47700,47200,47200,46700,46700,41700,41700,41200,40900,40900,40900,40900,40900,40900,40900,40900,40400,39100,38600,33600,33200,32900,32900,32900,32900,32400,32400,31900,31900,29900,28900,28900,28900,26400,26400,26400,26400,26400,21400,21400,21100,21100,18800,18800,18800,18400,18400,18400,18400,12900,10900,10900,10900,10900,10200,10200,10200,10200,10200,10200,10200,10200,10200,10200,10200,10200,9700,9700,9700,8700,6700,6700,6200,6200,6200,6200,6200,6200,6200,4200,4200,4200,4200,3700,3700,3000,3000,3000,3000,3000,3000,3000,3000,2000,2000,2000,2000,2000,2000,2000,2000,2000,2000,2000,2000,2000,2000,2000],"positives":54300,"rows":1250000,"segments":50}},"thresholds_q":[9548,9818,10089,10356,10621,10881,11156,11405,11661,11917,12166,12409,12652,12910,13169,13419,13664,13911,14149,14375,14611,14844,15086,15304,15522,15731,15948,16185,16409,16624,16832,17049,17254,17446,17626,17841,18034,18227,18418,18600,18800,18989,19164,19358,19549,19727,19916,20112,20313,20533,20715,20916,21100,21269,21472,21703,21900,22144,22397,22669,22904,23137,23389,23651,24026,24352,24677,25011,25485,25958,26251,26666,27178,27551,28080,28395,28746,29191,29752,30063,30412,30734,30972,31278,31675,31935,32254,32628,32786,33307,33533,34062,34327,34593,34823,35359,35710,36202,36392,36572,36637,36861,37016,37131,37354,37403,37733,37880,38218,38594,38786,39321,39458,39591,39659,39956,40093,41039,41459,41541,41664,42035,42107,42490,42887,43224,43323,43718,45051,45320,45880,45971,47143,51119,51873,55633,55809,55814,59